{
  "reviewId": "rev-baseline-mining-001",
  "packageId": "mcpkg-baseline-mining-001",
  "moduleId": "acquisition",
  "status": "pending",
  "owner": "role:acquisition-owner",
  "risk": "medium",
  "summary": "Review first-session baseline object candidates and supply missing affected ids.",
  "decisionImpact": {
    "affectedWorkflows": [],
    "affectedMetrics": [],
    "affectedInterfaces": [],
    "affectedOwners": [],
    "decisionUse": "Confirm baseline candidates and identify affected model ids before a staged proposal is prepared.",
    "blastRadius": "unknown"
  },
  "reviewEvidenceMode": "not-checked",
  "sourceAdequacy": "insufficient",
  "slaBand": "normal",
  "changes": [
    {
      "changeId": "chg-baseline-mining-001",
      "kind": "new-object",
      "confidence": "medium",
      "risk": "medium",
      "claimKind": "owner-claim",
      "evidenceGrade": "external",
      "sourceRisk": ["unknown"],
      "affectedIds": [],
      "evidence": [
        {
          "sourceEventId": "srcevt-baseline-mining-001",
          "locator": "document:acquisition-baseline#section-boundary",
          "excerpt": "Acquisition owns the first module boundary through qualified lead handoff."
        }
      ],
      "proposedAction": "needs-info",
      "highRiskReasons": []
    }
  ],
  "requiredActions": [
    {
      "action": "human-review",
      "changeId": "mcpkg-baseline-mining-001",
      "reason": "Confirm baseline candidates and provide the affected model ids before a staged proposal is prepared."
    }
  ],
  "decisions": [],
  "audit": [
    {
      "actor": "agent",
      "action": "prepare-review-package",
      "timestamp": "2026-06-22T08:02:00Z",
      "summary": "Prepared baseline mining review package for role:acquisition-owner.",
      "result": "pending"
    }
  ],
  "safety": {
    "noAcceptedMutation": true,
    "noAutoPromotion": true,
    "noCommit": true,
    "noSourceWriteback": true
  }
}
